ID;Nome;Categoria Pai;Descrição;Meta título;Meta descrição;URL amigavel;Ativo
100;Como Jogar;3;Aprenda os fundamentos de Magic: The Gathering, regras básicas, dicas e estratégias para começar a jogar.;Como Jogar Magic;Guia básico para aprender a jogar Magic: The Gathering.;como-jogar-mtg;1
102;Como Jogar;4;Conheça as regras essenciais de Pokémon, dicas de jogo e estratégias para novos jogadores.;Como Jogar Pokémon;Guia básico para aprender a jogar Pokémon.;como-jogar-pokemon;1
104;Como Jogar;5;Entenda as regras principais de Yu-Gi-Oh!, com orientações para iniciantes e estratégias de jogo.;Como Jogar Yu-Gi-Oh!;Guia básico para aprender a jogar Yu-Gi-Oh!;como-jogar-yugioh;1
106;Como Jogar;6;Aprenda as regras de One Piece TCG, incluindo conceitos básicos e dicas para jogadores iniciantes.;Como Jogar One Piece;Guia básico para aprender a jogar One Piece.;como-jogar-onepiece;1
108;Como Jogar;7;Descubra os fundamentos de Lorcana, regras essenciais e estratégias para novos jogadores.;Como Jogar Lorcana;Guia básico para aprender a jogar Lorcana.;como-jogar-lorcana;1
110;Como Jogar;8;Conheça as regras de Digimon TCG, dicas para iniciantes e estratégias para melhorar seu jogo.;Como Jogar Digimon;Guia básico para aprender a jogar Digimon.;como-jogar-digimon;1
